{
  "schema_version": "0.2",
  "mode": "confirmed_l1",
  "confirmed": true,
  "execution_level": "LEVEL_1_LOW_RISK_CLEANUP",
  "allow_roots": ["C:\\SyntheticTemp"],
  "audit_path": "C:\\SyntheticOutput\\cleanup-audit.jsonl",
  "summary": {
    "total_results": 2,
    "would_clean": 0,
    "cleaned": 1,
    "blocked": 0,
    "skipped": 1,
    "failed": 0,
    "bytes_reclaimed": 4096,
    "execution_performed": true
  },
  "results": [
    {
      "path": "C:\\SyntheticTemp\\old.tmp",
      "category": "temp_file",
      "action": "delete_file",
      "status": "cleaned",
      "reason": "confirmed L1 file cleanup completed",
      "bytes_reclaimed": 4096,
      "evidence": [
        {
          "source": "filesystem_metadata",
          "fact": "synthetic example metadata"
        },
        {
          "source": "confirmation",
          "fact": "confirm flag is true and all L1 gates passed"
        }
      ],
      "audit_event": {
        "event_id": "11111111-1111-4111-8111-111111111111",
        "timestamp": "2026-07-10T12:00:00Z",
        "actor": "pc-cleanguard-skill",
        "path": "C:\\SyntheticTemp\\old.tmp",
        "category": "temp_file",
        "action": "delete_file",
        "status": "cleaned",
        "reason": "confirmed L1 file cleanup completed",
        "bytes_reclaimed": 4096,
        "evidence": [
          {
            "source": "filesystem_metadata",
            "fact": "synthetic example metadata"
          },
          {
            "source": "confirmation",
            "fact": "confirm flag is true and all L1 gates passed"
          }
        ],
        "confirmed": true,
        "dry_run": false,
        "execution_method": "pathlib_unlink",
        "execution_level": "LEVEL_1_LOW_RISK_CLEANUP"
      }
    },
    {
      "path": "C:\\SyntheticTemp\\failure.dmp",
      "category": "crash_dump",
      "action": "skip",
      "status": "skipped",
      "reason": "category is outside the PR15 L1 allowlist",
      "bytes_reclaimed": 0,
      "evidence": [
        {
          "source": "l1_allowlist",
          "fact": "candidate category is not temp, cache, or log"
        }
      ],
      "audit_event": {
        "event_id": "22222222-2222-4222-8222-222222222222",
        "timestamp": "2026-07-10T12:00:01Z",
        "actor": "pc-cleanguard-skill",
        "path": "C:\\SyntheticTemp\\failure.dmp",
        "category": "crash_dump",
        "action": "skip",
        "status": "skipped",
        "reason": "category is outside the PR15 L1 allowlist",
        "bytes_reclaimed": 0,
        "evidence": [
          {
            "source": "l1_allowlist",
            "fact": "candidate category is not temp, cache, or log"
          }
        ],
        "confirmed": true,
        "dry_run": false,
        "execution_method": "none",
        "execution_level": "LEVEL_1_LOW_RISK_CLEANUP"
      }
    }
  ]
}
