{
  "schema_version": "0.2",
  "mode": "confirmed_l1_quarantine",
  "confirmed": true,
  "execution_level": "LEVEL_1_LOW_RISK_CLEANUP",
  "allow_roots": ["C:\\SyntheticScratch"],
  "audit_path": "C:\\SyntheticOutput\\audit.jsonl",
  "summary": {"total_results": 1, "would_clean": 0, "cleaned": 0, "quarantined": 1, "blocked": 0, "skipped": 0, "failed": 0, "bytes_reclaimed": 0, "execution_performed": true},
  "results": [{
    "path": "C:\\SyntheticScratch\\sample.tmp",
    "category": "temp_file",
    "action": "quarantine_file",
    "status": "quarantined",
    "reason": "confirmed L1 file moved to quarantine item 11111111-1111-4111-8111-111111111111",
    "bytes_reclaimed": 0,
    "evidence": [{"source": "synthetic_example", "fact": "all L1 and quarantine gates passed"}],
    "audit_event": {
      "event_id": "22222222-2222-4222-8222-222222222222", "timestamp": "2026-07-11T08:00:00Z", "actor": "pc-cleanguard-skill",
      "path": "C:\\SyntheticScratch\\sample.tmp", "category": "temp_file", "action": "quarantine_file", "status": "quarantined",
      "reason": "confirmed L1 file moved to quarantine item 11111111-1111-4111-8111-111111111111", "bytes_reclaimed": 0,
      "evidence": [{"source": "synthetic_example", "fact": "all L1 and quarantine gates passed"}],
      "confirmed": true, "dry_run": false, "execution_method": "pathlib_replace", "execution_level": "LEVEL_1_LOW_RISK_CLEANUP"
    }
  }]
}
